{
  "$schema": "https://json-schema.org/draft/2020-12/schema",
  "$id": "https://mechaminer.local/schemas/envelope.schema.json",
  "title": "SCH-CNT-001 common definition envelope",
  "description": "The nine fields every independently addressable content definition carries. The project-owned typed validator in src/MechaMiner.Content/Envelope/EnvelopeReader.cs remains authoritative; this schema is the draft 2020-12 mirror kept for editor and tool interoperability, and a fixture corpus proves the two reach the same accept/reject verdict on every structural case. See content/schemas/README.md.",
  "type": "object",
  "additionalProperties": false,
  "propertyNames": { "$ref": "#/$defs/snake_case_field" },
  "required": [
    "id",
    "schema_version",
    "content_version",
    "status",
    "tags",
    "source_refs"
  ],
  "properties": {
    "id": { "$ref": "#/$defs/stable_id" },
    "schema_version": { "$ref": "#/$defs/version" },
    "content_version": { "$ref": "#/$defs/version" },
    "status": { "$ref": "#/$defs/status" },
    "name_key": { "$ref": "#/$defs/name_key" },
    "summary_key": { "$ref": "#/$defs/summary_key" },
    "tags": { "$ref": "#/$defs/tags" },
    "source_refs": { "$ref": "#/$defs/source_refs" },
    "presentation_id": { "$ref": "#/$defs/presentation_id" }
  },
  "$defs": {
    "snake_case_field": {
      "title": "A schema-declared field name",
      "description": "Property names use snake_case. This constrains field names in a definition, not keys in a flat catalog: content/localization/<locale>.json is keyed by <category>.<stable_id>.<role>, where a property name is data rather than a field.",
      "type": "string",
      "pattern": "^[a-z][a-z0-9_]*$"
    },
    "stable_id": {
      "title": "A stable, case-sensitive ASCII content ID",
      "description": "One alternative per content category. This schema cannot know which category a given file belongs to, so it accepts any category's grammar; the typed validator is told the category by the authoring directory and enforces the single correct one. An ID that matches no alternative is rejected by both.",
      "type": "string",
      "anyOf": [
        { "title": "resource", "pattern": "^RSC-[0-9]{2}$" },
        { "title": "mech", "pattern": "^MCH-[0-9]{2}$" },
        { "title": "enemy", "pattern": "^EN-[0-9]{2}$" },
        { "title": "shared elite modifiers", "pattern": "^ELT-[0-9]{2}$" },
        { "title": "boss", "pattern": "^BOSS-[0-9]{2}$" },
        { "title": "weapon", "pattern": "^W-[A-F]{2}$" },
        { "title": "weapon stat price formula", "pattern": "^FORMULA-[0-9]{2}$" },
        { "title": "branch", "pattern": "^W-[A-F]{2}(-[a-z0-9]+)+$" },
        { "title": "utility", "pattern": "^UTL-[A-FR][1-9]$" },
        { "title": "relic", "pattern": "^REL-[0-9]{2}$" },
        { "title": "powerup", "pattern": "^PU-[A-Z][0-9]{2}$" },
        { "title": "unlock", "pattern": "^UNL-[0-9]{2}$" },
        { "title": "mining site", "pattern": "^SITE-[0-9]{2}$" },
        { "title": "encounter schedule", "pattern": "^WAV-[0-9]{2}$" },
        { "title": "map generation contract", "pattern": "^MGC-[0-9]{2}$" },
        { "title": "player baseline", "pattern": "^PLAYER-[0-9]{2}$" }
      ]
    },
    "version": {
      "title": "A positive integer version",
      "description": "The initial schema_version and content_version of every first-authored definition is 1. schema_version increments when its schema changes field meaning; content_version increments on each subsequent revision.",
      "type": "integer",
      "minimum": 1,
      "x-authority": {
        "minimum": {
          "source": "TDD-CONTENT-DATA",
          "section": "Initial versions",
          "kind": "sourced",
          "derivation": "the initial value of every first-authored definition is 1 and both versions only ever increment, so no valid version is below 1; there is no upper bound because a definition may be revised without limit"
        }
      }
    },
    "status": {
      "title": "Lifecycle state",
      "description": "Release bundles exclude development and disabled unless configured otherwise. Tokens are exact and case-sensitive.",
      "type": "string",
      "enum": ["development", "enabled", "disabled", "retired"]
    },
    "name_key": {
      "title": "Localization key for the player-facing name",
      "description": "Never literal player-facing text. Omit the key entirely when a definition has no player-facing name; a JSON null is not legal and an empty string is not either, because the empty string is what the compiler materializes for an omitted field.",
      "type": "string",
      "pattern": "^[a-z][a-z0-9_]*\\.[A-Za-z0-9][A-Za-z0-9_-]*\\.name$"
    },
    "summary_key": {
      "title": "Localization key for the concise player-facing summary",
      "description": "Present where a concise player-facing summary is relevant, omitted otherwise.",
      "type": "string",
      "pattern": "^[a-z][a-z0-9_]*\\.[A-Za-z0-9][A-Za-z0-9_-]*\\.summary$"
    },
    "tags": {
      "title": "Closed query and tooling vocabulary",
      "description": "An empty array is the expected value. A tag never carries behavior, never selects an implementation, and never gates a rule.",
      "type": "array",
      "uniqueItems": true,
      "items": { "$ref": "#/$defs/tag" }
    },
    "tag": {
      "title": "A term from the closed tags vocabulary",
      "description": "The vocabulary starts empty, so every tag is currently rejected and [] is the only accepted value of tags. A term is added to this enum in the same change that first uses it, mirroring TagVocabulary.Declared in src/MechaMiner.Content/Envelope/TagVocabulary.cs.",
      "type": "string",
      "enum": []
    },
    "source_refs": {
      "title": "The sources this definition implements",
      "description": "Each element is an optional scope prefix followed by a stable reference. A file path, a line number, or any path:line pair is not a legal element: paths and line numbers move whenever a document is edited, so a reference built from them decays silently. A scope prefix is a selector into this definition's own JSON, which the typed validator additionally resolves against the definition. uniqueItems is now the only statement anywhere that a repeated element is not allowed here, and that changed without this description being updated with it. When the keyword was added at 59a4986 it restated a classification the field already carried: EnvelopeSchema declared it ArrayOrder.IdSet, and CanonicalJsonWriter.WriteIdSet throws on a repeat, so the ban was enforced on the way out and this said the same thing on the way in. The classification was reversed to ArrayOrder.OrderedArray at f4f38a1, because a sort over these elements sorts by the scope prefix rather than by the ID and doc 40's clause granting canonical ID order does not authorise that. An authored-order array is emitted through WriteOrderedArray, which does not check for repeats, so the write-time ban went with the classification. The typed envelope reader emits no diagnostic for a repeat either. This keyword is therefore the whole of the rule now, and it is in the mirror rather than in the authoritative validator - worth knowing before anyone treats the schemas as decoration. No authored file repeats an element - 138 files under content/ excluding schemas/ and localization/, measured at 715ef53 - so the keyword forbids nothing that is authored today, and that is a claim about one corpus at one ref rather than a property of the field.",
      "type": "array",
      "uniqueItems": true,
      "items": { "$ref": "#/$defs/source_ref" }
    },
    "source_ref": {
      "title": "One source reference",
      "description": "element := [ scope \": \" ] reference; scope := segment ( \".\" segment | index )*; segment := [a-z][a-z0-9_]*; index := \"[]\" | \"[\" digits \"]\" | \"[\" digits \"..\" digits \"]\"; reference := ( ( \"GDD-\" | \"TDD-\" ) [A-Z0-9-]+ | \"DEC-\" digits{3} | \"TDR-\" digits{3} | \"TR-\" [A-Z]+ \"-\" digits{3} ) [ \"#\" anchor ]; anchor := [a-z0-9-]+. The pattern is anchored because JSON Schema pattern is a search, not a full match, so an unanchored pattern would accept 'docs/foo.md:12 GDD-MINING'.",
      "type": "string",
      "pattern": "^(?:[a-z][a-z0-9_]*(?:\\.[a-z][a-z0-9_]*|\\[\\]|\\[[0-9]+\\]|\\[[0-9]+\\.\\.[0-9]+\\])*: )?(?:(?:GDD|TDD)-[A-Z0-9-]+|DEC-[0-9]{3}|TDR-[0-9]{3}|TR-[A-Z]+-[0-9]{3})(?:#[a-z0-9-]+)?$"
    },
    "presentation_id": {
      "title": "Logical presentation entry, required absent",
      "description": "Required absent: a definition carrying this field is an error. No accepted document says what a presentation definition contains, so no ID grammar has been minted for one, and minting a shape for a category with zero members would be inventing structure ahead of need. The field was declared-optional with a non-empty-string constraint, which accepted any string an author invented and validated nothing about it; rejecting the field outright fails loudly the first time somebody adds one instead of accepting an unauthorized value. The subschema is 'not' over the empty schema, which rejects every instance, so the fault is the field's presence rather than its shape and an authored empty string is rejected by the same rule rather than as an empty declared-optional field. The typed validator reports MMC-2010 and names the field. When an accepted document mints a presentation ID grammar, this declaration becomes that grammar; until then it has no minLength, because a length bound on a value that can never be authored explains nothing.",
      "not": {}
    }
  }
}
